{
  "schema_version": "1.0",
  "run_id": "filled-in-by-regenerate",
  "summary": "Alice built queuebox's durable core: a SQLite job store with forward-version-guarded migrations (E-001), a lock-serialised claim path that guards the state transition in SQL (E-002), and an ADR that records the rejected Postgres option and the throughput ceiling the design accepts (E-004). The migration refactor (E-008) shows the store evolving without breaking existing files. The weak points are concrete: test_worker_runs never calls the worker, so the worker's failure path is untested (E-005), and the worker declares MAX_ATTEMPTS but never enforces it, contradicting its 'bounded retries' docstring (E-006). Collaboration and technical leadership have no evidence in this repository even though another contributor was present; the HTTP module is theirs and is not credited (E-009). Security was not exercised by any inspected code.",
  "inspected": [
    {"repo": "R1", "path": "src/queuebox/worker.py", "sample_id": "S-R1-001"},
    {"repo": "R1", "path": "src/queuebox/store.py", "sample_id": "S-R1-002"},
    {"repo": "R1", "path": "tests/test_store.py", "sample_id": "S-R1-003"},
    {"repo": "R1", "path": "docs/adr/001-sqlite-wal.md", "sample_id": "S-R1-004"},
    {"repo": "R1", "path": ".github/workflows/ci.yml", "sample_id": "S-R1-005"},
    {"repo": "R1", "path": "src/queuebox/web.py", "sample_id": "S-R1-006"},
    {"repo": "R1", "path": "README.md", "sample_id": "S-R1-007"},
    {"repo": "R1", "commit": "7d09825ba17d"},
    {"repo": "R1", "commit": "2865bd96e1f1"}
  ],
  "evidence": [
    {"id": "E-001", "kind": "source_code", "repo": "R1", "path": "src/queuebox/store.py", "line_start": 20, "line_end": 29, "polarity": "strength", "verification": "directly_inspected", "observation": "Migrations are keyed on PRAGMA user_version; a store written by a newer version is refused instead of being silently downgraded.", "interpretation": "Deliberate on-disk compatibility boundary with forward-version protection.", "competencies": ["architecture", "engineering_judgment", "code_quality"], "confidence": "medium", "caveats": ["Migration of a populated v1 database was not executed."]},
    {"id": "E-002", "kind": "source_code", "repo": "R1", "path": "src/queuebox/store.py", "line_start": 31, "line_end": 43, "polarity": "strength", "verification": "directly_inspected", "observation": "claim() selects the oldest queued job and updates it with a state = 'queued' guard inside a lock, then commits.", "interpretation": "Understands the double-claim race; guards the transition at both the lock and SQL level.", "competencies": ["system_design", "problem_solving", "code_quality"], "confidence": "medium", "caveats": ["Single-process only; the lock does not help across processes, which the ADR acknowledges."]},
    {"id": "E-003", "kind": "source_code", "repo": "R1", "path": "src/queuebox/store.py", "line_start": 14, "line_end": 18, "polarity": "strength", "verification": "directly_inspected", "observation": "Connection opened with check_same_thread=False and WAL mode, paired with an explicit threading.Lock.", "interpretation": "Knows SQLite's threading and journaling mechanics well enough to relax a default safely.", "competencies": ["technical_depth"], "confidence": "medium", "caveats": []},
    {"id": "E-004", "kind": "design_doc", "repo": "R1", "path": "docs/adr/001-sqlite-wal.md", "line_start": 1, "line_end": 14, "polarity": "strength", "verification": "directly_inspected", "observation": "ADR states context, rejects Postgres for an operational-dependency reason, and records the single-host throughput ceiling as a consequence.", "interpretation": "Explicit tradeoff reasoning with a rejected alternative and a named revisit trigger.", "competencies": ["engineering_judgment", "architecture", "ownership"], "confidence": "medium", "caveats": []},
    {"id": "E-005", "kind": "test_code", "repo": "R1", "path": "tests/test_store.py", "line_start": 14, "line_end": 17, "polarity": "weakness", "verification": "directly_inspected", "observation": "test_worker_runs only calls store.claim(); the worker module is never imported or exercised.", "interpretation": "Test name overstates coverage; the worker's exception path has no oracle.", "competencies": ["testing"], "confidence": "high", "caveats": []},
    {"id": "E-006", "kind": "source_code", "repo": "R1", "path": "src/queuebox/worker.py", "line_start": 7, "line_end": 20, "polarity": "weakness", "verification": "directly_inspected", "observation": "MAX_ATTEMPTS is declared but never read; on failure the worker sleeps 0.1s and re-raises, so a failing job stays 'running' forever.", "interpretation": "The documented bounded-retry behaviour is not implemented; failure recovery is incomplete.", "competencies": ["operations", "problem_solving"], "confidence": "high", "caveats": []},
    {"id": "E-007", "kind": "ci_config", "repo": "R1", "path": ".github/workflows/ci.yml", "line_start": 1, "line_end": 9, "polarity": "strength", "verification": "directly_inspected", "observation": "CI installs the package and runs pytest on push and pull request.", "interpretation": "Baseline regression gate exists; CI results themselves were not available offline.", "competencies": ["testing", "operations"], "confidence": "medium", "caveats": ["Workflow read, not executed; no CI status was collected."]},
    {"id": "E-008", "kind": "commit", "repo": "R1", "commit": "7d09825ba17d", "polarity": "strength", "verification": "directly_inspected", "observation": "Adds a v2 migration (attempt counting) on top of the existing schema rather than recreating the table.", "interpretation": "Evolves persisted state incrementally and maintains its own earlier work.", "competencies": ["ownership", "learning", "architecture"], "confidence": "medium", "caveats": []},
    {"id": "E-009", "kind": "source_code", "repo": "R1", "path": "src/queuebox/web.py", "line_start": 1, "line_end": 10, "polarity": "strength", "verification": "directly_inspected", "observation": "Minimal HTTP health endpoint.", "interpretation": "Cited to show the service boundary; authorship is checked by the engine.", "competencies": ["architecture"], "confidence": "low", "caveats": ["Possibly another contributor's file."], "claimed_attribution": "probable"},
    {"id": "E-010", "kind": "source_code", "repo": "R1", "path": "src/queuebox/store.py", "line_start": 120, "line_end": 130, "polarity": "strength", "verification": "directly_inspected", "observation": "Intentionally invalid citation kept in the example to show verifier rejection.", "interpretation": "Should be rejected.", "competencies": ["system_design"], "confidence": "low", "caveats": []},
    {"id": "E-011", "kind": "documentation", "repo": "R1", "path": "README.md", "line_start": 1, "line_end": 3, "polarity": "neutral", "verification": "repository_claimed", "observation": "README describes the product as a durable single-host job queue.", "interpretation": "States the user problem and deployment constraint; no usage or adoption evidence.", "competencies": ["product_thinking"], "confidence": "low", "caveats": []}
  ],
  "competencies": [
    {"id": "problem_solving", "score": 3, "rationale": "Race-aware claim path; incomplete failure handling counts against it.", "supporting_evidence_ids": ["E-002"], "counterevidence_ids": ["E-006"], "counterevidence_reviewed": true, "confidence": "medium"},
    {"id": "code_quality", "score": 3, "rationale": "Small, cohesive store with clear error type.", "supporting_evidence_ids": ["E-001", "E-002"], "counterevidence_ids": [], "counterevidence_reviewed": true, "confidence": "medium"},
    {"id": "architecture", "score": 4, "rationale": "Versioned storage boundary plus a recorded design decision; HTTP module is not the candidate's.", "supporting_evidence_ids": ["E-001", "E-004", "E-008", "E-009"], "counterevidence_ids": [], "counterevidence_reviewed": true, "confidence": "medium"},
    {"id": "system_design", "score": 3, "rationale": "Concurrency handled for one process; multi-process limit acknowledged.", "supporting_evidence_ids": ["E-002", "E-004", "E-010"], "counterevidence_ids": [], "counterevidence_reviewed": true, "confidence": "medium"},
    {"id": "testing", "score": 2, "rationale": "CI gate exists but the worker is untested and one test is misnamed.", "supporting_evidence_ids": ["E-007"], "counterevidence_ids": ["E-005"], "counterevidence_reviewed": true, "confidence": "medium"},
    {"id": "security", "score": null, "rationale": "No inspected code crosses a trust boundary.", "supporting_evidence_ids": [], "counterevidence_ids": [], "counterevidence_reviewed": false, "confidence": "low", "not_observable_reason": "no_evidence"},
    {"id": "operations", "score": 2, "rationale": "CI present; failure recovery in the worker is incomplete.", "supporting_evidence_ids": ["E-007"], "counterevidence_ids": ["E-006"], "counterevidence_reviewed": true, "confidence": "low"},
    {"id": "technical_depth", "score": 3, "rationale": "Correct use of SQLite threading and WAL settings.", "supporting_evidence_ids": ["E-003"], "counterevidence_ids": [], "counterevidence_reviewed": true, "confidence": "medium"},
    {"id": "engineering_judgment", "score": 4, "rationale": "Explicit rejected alternative and named revisit trigger; forward-version refusal.", "supporting_evidence_ids": ["E-004", "E-001"], "counterevidence_ids": [], "counterevidence_reviewed": true, "confidence": "medium"},
    {"id": "learning", "score": 3, "rationale": "Iterated the schema through a migration rather than a rewrite.", "supporting_evidence_ids": ["E-008"], "counterevidence_ids": [], "counterevidence_reviewed": true, "confidence": "low"},
    {"id": "ownership", "score": 3, "rationale": "Maintains and evolves the store across commits; records lifecycle decisions.", "supporting_evidence_ids": ["E-008", "E-004"], "counterevidence_ids": [], "counterevidence_reviewed": true, "confidence": "medium"},